<?xml version="1.0" encoding="UTF-8" ?>
<!-- generated by ToXgene Version 2.3 on Thu Jun 07 16:17:45 EDT 2007 -->
<Security id="29674" xmlns:xsi="http://www.w3.org/2001/XMLSchema-instance"
    xmlns="http://tpox-benchmark.com/security"
    xsi:schemaLocation="http://tpox-benchmark.com/security security.xsd">
    <Symbol>PRDGX</Symbol>
    <Name>T. Rowe Price Dividend Growth</Name>
    <ShortName>PRDGX</ShortName>
    <SecurityType>Stock Fund</SecurityType>
    <SecurityInformation>
        <FundInformation>
            <FundFamily>T. Rowe Price</FundFamily>
            <Industry>Software&amp;Programming</Industry>
            <Industry>OilWellServices&amp;Equipment</Industry>
            <Industry>Retail(Apparel)</Industry>
            <Industry>Insurance(Life)</Industry>
            <Industry>Paper&amp;PaperProducts</Industry>
            <Industry>Retail(Drugs)</Industry>
            <AssetGroup>Large Value</AssetGroup>
            <Category Capitalization="Medium" Class="Value"/>
            <ExpenseRatio>0.16</ExpenseRatio>
            <TotalAssets>64691363840</TotalAssets>
            <MinInitialInvestment>3000</MinInitialInvestment>
            <MinSubsequentInvestment>100</MinSubsequentInvestment>
        </FundInformation>
        <Description>
            <FundDescription>dolphins among the foxes promise evenly close, quiet warhorses;decoys
                would lose quietly except the frays?finally busy realms over the careful grouches
                hang except the evenly furious foxes?final hockey atop the quick instructions may
                mold in place of the multipliers?permanent dolphins according to the idly ruthless
                dolphins can eat under the careful orbits:ironically even asymptotes would affix
                slow, thin pinto;pearls besides the ruthless hockey try to snooze always atop the
                blithely final beans?courts could grow quickl<Risk>closely quick dependencies</Risk>
                silently brave grouches among the decoys detect throughout the fluffy
                instructions.ironic orbits try to kindle at the silently stealthy
                escapades;regularly final sentiments will hang.quickly permanent excuses print
                instead of the even pearls.grouches will maintain outside the even, brave
                frays;permanent, idle Tiresias at the fluffy theodolites affix sly somas--quiet,
                fluffy theodoeven, enticing ideas breach busily:somas poach.careful, idle sentiments
                mold warthogs.silent multipliers past the finally slow excuses shall have to impress
                fluffily fluffily sly sauternes;enticing, fluffy Tiresias atop the finally furious
                tithes must impress enticingly decoys!courts run busy realms;permanent, ironic
                grouches sublate slowly of the carefully bold decoys;quiet, ironic warthogs haggle
                sometimes orbits.final hockey sublate?busily bold orbits shall integrate
                regularly!daring instructions ought <CEO>frays ought to solve attainments</CEO>
                carefully blithe beans should have to solve idly behind the foxes?attainments need
                to promise thinly ruthless, permanent escapades.regularly ironic sheaves across the
                silently stealthy escapades shall have to detect furiously with the slow, brave
                sentiments!permanent grouches will mold since the furious excuses?fluffy, thin frays
                except the bravely final warthogs x-ray finally throughout the stealthly final
                epitaphs.quick, silent
                s<Holdings>permanent, stealthy grouches along the ironic, q</Holdings> dogged,
                furious notornis shall have to lose bravely never fluffy grouches:furious foxes will
                have to snooze busily?fluffy courts thrash?enticing, ruthless tithes among the
                stealthy, quiet pearls sleep slyly sly sauternes;enticingly
                permanen<Keyword>blithe sauternes should</Keyword> depths will have to serve quickly
                permanent, ironic warhorses:quick, idle courts should have to unwind according to
                the closely even orbits.regularly slow patterns lose enticingly sly foxes--always
                sly pinto could use sometimes bravely regular orbits;Tiresias up the permanent, sly
                excuses sublate blithely through the sly, slow warthogs?brave, brave players
                haggle;fluffy pearls alongside of the even sheaves should haggle beans:closely
                bol</FundDescription>
            <Management>stealthly regular decoys should impress since the brave, idle
                multipliers!instructions should have to solve blithely fluffy gifts?sometimes
                regular platelets lose thinly since the even sentiments:busily dogged notornis must
                have to snooze--pinto play thinly--courts affix tithes:quiet multipliers should have
                to wake busily for the quickly ironic Tiresias!fluffy sentiments may haggle?busy
                dugouts from the never brave pearls grow ironic, bold escapades--furious pinto over
                the permanent theodolites should have to kindle quiet, daring sheaves--careful,
                dogged pains can detect.idle foxes can haggle daring<Risk>forges from t</Risk> sly
                epitaphs of the always furious escapades will have to doze escapades!even hockey
                doubt--furious pinto over the sometimes dogged grouches print into the thinly quick
                players!quick epitaphs above the frays affix quickly despite the multipliers--forges
                into the enticing pains play past the careful, stealthy players?grouches may hinder
                bravely quiet dependencies.enticing pearls above the dependencies do serve busily
                stealthly busy realms.idl<Keyword>regular patterns sleep silently blithe</Keyword>
                quick, daring players might promise atop the even tithes:slowly regular decoys can
                dazzle closely.quick players try to snooze doggedly above the busy escapades?even
                frays near the busily furious foxes sleep regularly to the furious foxes;asymptotes
                through the final realms nod epitaphs--enticingly fluffy tithes may integrate
                quietly busy notornis?pinto are ironically;carefully stealthy excuses around the
                busy, thin foxes poach ironically idly quick grouches!thin hockey can grow during
                the dogged dolphins;regularly permanent
                epi<Strategy>never silent gifts could cajole i</Strategy> sentiments affix inside
                the permanent, idle escapades.furious orbits cajole always--braids belive regularly
                sly, sly somas:slow, even dependencies sleep around the boldly close
                epitaphs:stealthy, daring theodolites must have to eat.thinly quick escapades before
                the evenly daring dolphins integrate stealthy platelets:final, quiet orbits must
                run:s<Competitor>sauternes on the asymptotes woul</Competitor> theodolites need to
                sublate furiously ironically close frets;quiet, thin foxes atop the enticingly
                fluffy pains nag ruthless gifts;bold, daring gifts can solve furiously!slow gifts
                can affix above the permanently stealthy sentiments:final foxes nag slowly permanent
                orbits;asymptotes over the blithe dinos was evenly with the quick courts--stealthy,
                thin decoys beneath the sly, thin frets dazzle brave, furious grouches!sly, even
                Tiresias unwind from the quick, ruthless multipliers;blithe, blithe excuses should
                have to x-ray!fruthless Tiresias haggle enticingly sheaves;regular frets beyond the
                brave, dogged epitaphs can wake finally under the permanent, furious
                multipliers.orbits need to snooze with the bravely blithe platelets;beans cajole
                before the dinos--quiet, regul</Management>
        </Description>
    </SecurityInformation>
    <Price>
        <LastTrade>36.4325</LastTrade>
        <Ask>36.5506</Ask>
        <Bid>36.2165</Bid>
        <Price50DayAvg>37.4594</Price50DayAvg>
        <Price200DayAvg>40.5779</Price200DayAvg>
        <PriceToday>
            <PreviousClose>36.4325</PreviousClose>
            <Open>35.9288</Open>
            <High>38.6590</High>
            <Low>35.9069</Low>
        </PriceToday>
        <Price52week>
            <Price52week-low>35.9069</Price52week-low>
            <Price52week-low-date>2004-04-23</Price52week-low-date>
            <Price52week-high>40.5779</Price52week-high>
            <Price52week-high-date>2004-07-21</Price52week-high-date>
        </Price52week>
    </Price>
    <PE>37.38</PE>
    <Yield>3.29</Yield>
    <DivPerShare>1.04</DivPerShare>
</Security>
